公告日期,處分日期,處分字號,事業單位名稱／自然人姓名,負責人,違反職業安全衛生法條款,違反法規內容,備註
104/02/05,103/10/01,府勞職字第10336611100號,黃忠義,黃忠義,職業安全衛生設施規則第225條第1項暨職業安全衛生法第6條第1項第5款之規定，致發生第37條第2項第3款之職業災害。,對於高度2公尺以上之處所進行作業，勞工有墜落之虞者，未以架設施工架或其他方法設置工作台,
104/02/05,103/10/07,府勞職字第10336650600號,育宗工程有限公司,林清壽,1.職業安全衛生設施規則第228條暨職業安全衛生法第6條第1項第5款之規定。;2.營造安全衛生設施標準第11條之1暨職業安全衛生法第6條第1項第1、3、5款之規定。,1.對於勞工於高差超過1.5公尺以上之場所作業時，未設置使勞工安全上下之設備。;2.僱用勞工進入營繕場所從事作業，對於進入營繕工程工作場所作業人員，未提供適當安全帽，並使其正確戴用。,
104/02/05,103/10/29,府勞職字第10337300200號,陳漢榮（即漢昌工程行）,陳漢榮,營造安全衛生設施標準第11條之1暨職業安全衛生法第6條第1項第1、3、5款之規定。,僱用勞工進入營繕場所從事作業，對於進入營繕工程工作場所作業人員，未提供適當安全帽，並使其正確戴用,
104/02/05,103/12/15,府勞職字第10338298000號,達欣工程股份有限公司,王人正,1.職業安全衛生法第27條第1項第2、3款。;2.營造安全衛生設施標準第19條第1項暨職業安全衛生法第6條第1項第5款。;3.職業安全衛生設施規則第228條暨職業安全衛生法第6條第1項第5款。,1.與承攬人分別僱用勞工共同作業，對於承攬人所僱勞工於工地從事作業有墜落等具有嚴重危害勞工及發生職業災害之虞之工作場所，未「確實巡視」，亦未採積極具體作為「連繫」及要求承攬人依營造安全衛生設施標準第19條第1項規定，於高度2公尺以上開口處設置護欄、護蓋或安全網。;2.對於高度2公尺以上之開口部分從事營建施工管理作業，勞工有遭受墜落危險之虞者，未於該處設置護欄、護蓋或安全網等防護設備。;3.對勞工於高差超過1.5公尺以上之場所作業時，未設置能使勞工安全上下之設備。,
104/02/05,103/12/16,府勞職字第10338364702號,漢邑工程有限公司,廖有利,1.營造安全衛生設施標準第40條第1項第1、2款暨職業安全衛生法第6條第1項第5款，致發生第37條第2項第1款之職業災害。;2.營造安全衛生設施標準第45條第2款暨職業安全衛生法第6條第1項第5款，致發生第37條第2項第1款之職業災害。,1.對於高度5公尺以上施工架之構築，未由專任工程人員事先就預期施工時之最大荷重，依結構力學原理妥為安全設計，並簽章確認強度計算書及建立按施工圖說施作之查驗機制。;2.對於維持施工架之穩定，未以斜撐材作適當而充分之支撐。,
104/02/05,103/12/16,府勞職字第10338829202號,祐星工程有限公司,劉東興,1.起重升降機具安全規則第35條第2項第1、2款暨職業安全衛生法第6條第1項第1款。;2.起重升降機具安全規則第38條第1項第1、2、3款暨職業安全衛生法第6條第1項第1款。;3.職業安全衛生法第37條第2項第3款。,1.對於使用移動式起重機乘載或吊升勞工從事作業，未防止搭乘設備翻轉及脫落，及未使勞工佩戴安全帶或安全索。;2.對於使用移動式起重機吊掛搭乘設備搭載或吊升人員作業時，未依下列規定辦理：「一、搭乘設備應妥予安全設計，並事前將其構造設計圖、強度計算書及施工圖說等，委託中央主管機關認可之專業機構簽認。二、起重機載人作業前，應先以預期最大荷重之荷物，進行試吊測試。三、確認起重機所有之操作裝置、防脫裝置、安全裝置及制動裝置等，均保持功能正常；搭乘設備之本體、連接處及配件等，均無構成有害結構安全之損傷；吊索等，無變形、損傷及扭結情形。」;3.勞動場所發生災害之罹災人數在1人以上，且需住院治療之職業災害，未於8小時內通報勞動檢查機構。,
104/02/05,103/12/16,府勞職字第10338364701號,三友物業有限公司,溫美華,職業安全衛生設施規則第238條暨職業安全衛生法第6條第1項第5款，致發生第37條第2項第1款之職業災害。,對於工作場所有物體飛落之虞者，應設置防止物體飛落之設備，並供給安全帽等防護具，使勞工戴用。,刑事移送
104/02/05,103/12/05,府勞職字第10338327900號,華林營造股份有限公司,林世湖,1.職業安全衛生法第27條第1項第1、2、3款。;2.職業安全衛生設施規則第228條暨職業安全衛生法第6條第1項第5款。;3.營造安全衛生設施標準第19條第1項暨職業安全衛生法第6條第1項第5款。;4.營造安全衛生設施標準第11條之1暨職業安全衛生法第6條第1項第1、3、5款。,1.與承攬人分別僱用勞工共同作業，對於承攬人所僱勞工於工地從事作業有頭顱受創等具有嚴重危害勞工及發生職業災害之虞之工作場所，未「確實巡視」並「指揮」命令停止該危險作業；亦未採積極具體作為「連繫」及要求承攬人依營造安全衛生設施標準第11條之1規定，使勞工確實戴用合格之安全帽。;2.對勞工於高差超過1.5公尺以上之場所作業時，未設置能使勞工安全上下之設備。;3.對於高度2公尺以上之開口部分從事營建施工管理作業，勞工有遭受墜落危險之虞者，未於該處設置護欄、護蓋或安全網等防護設備。;4.對於進入營繕工程工作場所作業人員，未提供適當安全帽，並使其正確戴用。,
104/02/05,103/12/08,府勞職字第10338352900號,台灣大林組營造股份有限公司,谷田光司,1.職業安全衛生法第27條第1項第2、3款。;2.職業安全衛生設施規則第228條暨職業安全衛生法第6條第1項第5款。;3.營造安全衛生設施標準第135條第1款暨職業安全衛生法第6條第1項第5款。;4.營造安全衛生設施標準第131條第2款暨職業安全衛生法第6條第1項第5款。;5.營造安全衛生設施標準第20條第1款暨職業安全衛生法第6條第1項第5款。;6.營造安全衛生設施標準第19條第1項暨職業安全衛生法第6條第1項第5款。,1.與承攬人分別僱用勞工共同作業，對於承攬人所僱勞工於工地開口部分從事鋼筋作業有墜落等具有嚴重危害勞工及發生職業災害之虞之鋼筋工作場所，未「確實巡視」該危險作業及採積極具體作為「連繫」；亦未要求承攬人依營造安全衛生設施標準第19條第1項，於高度2公尺以上開口處設置護欄、護蓋或安全網。;2.對勞工於高差超過1.5公尺以上之場所作業時，未設置能使勞工安全上下之設備。;3.對於可調鋼管支柱為模板支撐之支柱時，以可調鋼管支柱連接使用。;4.對於模板支撐，未指派專人妥為設計，並簽章確認強度計算書及施工圖說。;5.對於設置之護欄，未具有腳趾板等構材。;6.對於高度2公尺以上之開口部分從事營建施工管理作業，勞工有遭受墜落危險之虞者，未於該處設置護欄、護蓋或安全網等防護設備。,
